Chat history,Difficulty,Description,,,,,
"Rocky Terrain: In Morocco (2022) and Spain (2019), rocky ground delayed digging parallel tunnels for rescue.",,,,,,,
Narrow Diameters: Small bore diameters posed severe challenges in accessing and pulling out the child.,,,,,,,
"Oxygen Issues: Limited oxygen supply often led to tragic outcomes, particularly for deep borewells.",,,,,,,
Trends and Global Perspective,,,,,,,
"Countries like India, Spain, and Morocco have seen recurring borewell incidents due to uncovered wells in agricultural areas. Technological innovations like robotic arms and parallel drilling methods have improved success rates, but the child's position—awkward angles, depth, and terrain—continues to define the difficulty level of each rescue.",,,,,,,
"For further details, you can explore the following resources:",,,,,,,
India Today Sujith Case,,,,,,,
CNN Report on Rayan in Morocco,,,,,,,
BBC Overview on Borewell Rescues.,,,,,,,
You said:,,,,,,,
ok tell amongthese unkown difficult 200 or more forms of trap in borewell,,,,,,,
ChatGPT said:,,,,,,,
Searched 5 sites,,,,,,,
,,,,,,,
"Here is a broader categorization of 200 or more forms of traps in borewells with respect to the difficult positions children or individuals may get stuck in, often influenced by depth, body positioning, and internal borewell features. These instances reflect both successes and failures.",,,,,,,
,,,,,,,
Common Borewell Traps:,,,,,,,
,,,,,,,
Partial Body Entry:,,,,,,,
,,,,,,,
"The child gets stuck halfway (head out, body trapped inside).",,,,,,,
Success is often limited as injuries occur while pulling out.,,,,,,,
,,,,,,,
Feet First - Narrow Borewell:,,,,,,,
,,,,,,,
"Child slides down feet-first, body compressing due to the cylindrical walls.",,,,,,,
Rescuers struggle to reach due to a lack of equipment for narrow entry points.,,,,,,,
,,,,,,,
Head-Down Entrapment:,,,,,,,
,,,,,,,
Extremely dangerous; oxygen deprivation occurs quickly. Rescue failure is high in such scenarios.,,,,,,,
,,,,,,,
Twisted Limb Positions:,,,,,,,
,,,,,,,
The child’s limbs get trapped in a bent/twisted posture due to uneven internal pipes.,,,,,,,
,,,,,,,
Slight Bumps/Protrusions Inside Borewell:,,,,,,,
,,,,,,,
Narrow crev,,,,,,,
You said:,,,,,,,
in table form unkown difficult,,,,,,,
ChatGPT said:,,,,,,,
,,,,,,,
"Below is a table format detailing unknown difficult positions where individuals, mostly children, have been trapped inside borewells. These cases are influenced by their body positions, borewell structure, and rescue complications.",,,,,,,
,,,,,,,
No.,Position Type,Description of Position,Difficulty,Cause,,,
1,"Feet First, Knees Bent",Child slides feet first; knees jammed in an uneven borewell section.,Very High,Sudden jerks while slipping.,,,
2,"Head Down, Body Compressed",Head-first entry; body weight compresses internal organs.,Extreme,Slippery sides during fall.,,,
3,"Arms Extended, Stuck Above Head",Child’s hands remain raised; arms locked due to tight borewell space.,High,Gravity forces arms upwards.,,,
4,Body Twisted at Torso,Rotation mid-fall; body stuck where borewell narrows.,Very High,Irregular pipe widths.,,,
5,Hip-Jammed in Uneven Diameter,The hips stop downward motion; body tilts and traps upper torso.,High,Varying pipe sizes internally.,,,
6,Legs Crossed and Folded,Both legs fold under pressure; reduced space for extraction.,High,Friction and body positioning.,,,
7,Head and Shoulders Jammed,Top portion of the body locked in the narrowest diameter.,Critical,Borewell narrowing at a shallow depth.,,,
8,Forearm Stuck in Pipe Crevice,One arm falls into a pipe gap while the body is compressed downward.,Extreme,Internal cracks and crevices in walls.,,,
9,Diagonal Body Slide,Child positioned diagonally; head to feet cannot align with borewell structure.,Very High,Fall at a tilted angle.,,,
10,Legs Spread Out - Hip Wedge,"The child’s legs spread, wedging hips tightly between walls.",Critical,Sudden jerk widening leg position.,,,
11,Body Tilted with Elbow Protrusion,Elbow caught on an uneven surface while body slants deeper.,High,Natural instinct to stop fall.,,,
12,Arm Twisted Backward,One arm bends unnaturally; severe pain makes child immobile.,Extreme,Arm impact during free fall.,,,
13,Feet and Ankles Locked,Feet jammed together tightly at a bottleneck borewell point.,High,Borewell narrowing suddenly.,,,
14,Neck Jammed on Pipe Edge,"The neck wedges at an uneven borewell section, choking oxygen supply.",Critical,Rough edges internally.,,,
15,Waist Locked - Upper Body Dangling,"Waist caught while head, shoulders hang below inside the borewell.",Critical,Gravity-based body positioning.,,,
16,Arm Lifted Above - Shoulder Stuck,Arm extended; shoulder trapped due to lack of rotation space.,High,Space constraints for upper limbs.,,,
17,Back Arched in “U” Shape,Spine arches under tension; body trapped in a bent U-shape.,Extreme,Internal borewell irregularities.,,,
18,Hip and Torso Tilt with Bent Knees,"Torso tilts sideways, and bent knees create a tight lock.",Very High,Friction and uneven space.,,,
19,"Single Shoulder Down, Twisted Body","One shoulder lower than the other, creating body torsion.",High,Irregular fall trajectory.,,,
20,Hips Above Shoulders,"Hips trapped higher than shoulders, reducing oxygen circulation.",Critical,Narrow borewell with uneven depths.,,,
21,Both Arms Pinned Tight to Sides,"Arms cannot move laterally, pinning body tightly inside the cylinder.",High,Friction due to body pressure.,,,
22,Chest Compressed - Unable to Breathe,"Chest area squeezes under pressure, reducing breathing capability.",Extreme,Borewell narrowing compresses ribs.,,,
23,Feet Wedged with Toes Locked,Toes jammed into a groove; child unable to move downward or upward.,High,Friction locks the lower limbs.,,,
24,Shoulders Stuck with Twisted Neck,"Shoulders caught in a gap, while neck twists uncomfortably to one side.",Critical,Irregular fall movement.,,,
25,Arm Locked Over Back,"One arm locked across the back, restricting space and movement.",High,Unnatural fall posture.,,,
26,Diagonal Spine Compression,Spine compressed diagonally while hips and shoulders resist extraction.,Critical,Pressure from both sides internally.,,,
27,Body Flipped Upside Down,Entire body in an upside-down position; head at the bottom.,Extreme,Gravity and sudden slippage.,,,
28,"One Foot Wedged, Body Dangling","One foot stuck, leaving the body suspended at a painful angle.",High,Friction on one foot during the fall.,,,
29,Bent Knees with Locked Ankles,"Ankles stuck together; knees bent, causing body immobility.",High,Borewell constriction below.,,,
30,Body Curved Along Cylinder Wall,"Body follows the curvature of a misaligned borewell wall, causing extreme tightness.",Extreme,Non-straight pipeline formation.,,,
,,,,,,,
"This table includes 30 types of difficult borewell trap positions that are considered unknown or uncommon, mainly due to the variability in borewell structure, body motion during a fall, and friction against uneven walls. These cases are particularly challenging for rescuers as each position requires a tailored extraction strategy. For the 200+ positions, the above can be extrapolated with finer details related to combinations of limb locks, spinal curves, head positioning, and internal borewell irregularities.",,,,,,,
You said:,,,,,,,
under the borewell such assure ofwater and counter bore near and difficults ibthat,,,,,,,
ChatGPT said:,,,,,,,
,,,,,,,
"When a borewell is drilled and water is found below the surface, the situation can become even more difficult during a rescue operation, particularly when a child or individual is trapped inside. Borewells often encounter counterbores, water assurance layers, or other obstructions near the water table that complicate rescue efforts. Let’s break down these challenges:",,,,,,,
,,,,,,,
Borewell Structure and Water Assurance Challenges:,,,,,,,
,,,,,,,
Water Table Encounter:,,,,,,,
,,,,,,,
"When a child falls to a depth where water begins to flow, the water table can obstruct breathing and lead to drowning risks.",,,,,,,
Water-filled borewells add complexity to rescue operations as pumps or vacuum equipment are required to de-water the borewell.,,,,,,,
,,,,,,,
Counter Bores (Adjacent Bores):,,,,,,,
,,,,,,,
Counter bores are often dug near a main borewell for structural or water extraction purposes.,,,,,,,
"These can create weak soil stability and even collapse, trapping a person further under the debris.",,,,,,,
,,,,,,,
Difficult Borewell Depths:,,,,,,,
,,,,,,,
"Borewells reaching depths of 100 to 1,000 feet create extreme pressure, narrowing the margin for error.",,,,,,,
"The air inside such borewells becomes stale and oxygen-depleted, worsening survival chances.",,,,,,,
Rescue Difficulties with Borewell Water Levels:,,,,,,,
No.,Challenge,Description,Impact,,,,
1,Water Table at Rescue Depth,"Water starts flowing at certain depths, increasing drowning risks.",Critical for survival.,,,,
2,Soil Erosion at Water Layer,Soil loosens and collapses into the borewell due to water flow.,Traps the victim further.,,,,
3,Presence of Multiple Borewells,"Nearby borewells weaken ground stability, risking sudden collapses.",Slows excavation rescue.,,,,
4,Rise of Groundwater During Rescue,"Pumping water out causes pressure differences, complicating air circulation.","Blocks breathing, reduces oxygen.",,,,
5,Obstructed Suction Attempts,Waterlogged borewell walls make suction tools ineffective for extraction.,Delays rescue efforts.,,,,
6,Oxygen Supply Below Water Table,Lack of oxygen worsens survival times under waterlogged layers.,Extreme hazard to victim.,,,,
7,Counter Bore Connections,Water movement from counter bores floods the main borewell.,Adds rescue complications.,,,,
8,Rescue Device Malfunctions,Water entry damages mechanical devices and cameras.,Impairs visibility and accuracy.,,,,
9,Sludge and Debris Blockage,"Debris accumulates near water flow, trapping victims tightly.",Prevents upward movement.,,,,
10,Water Pressure Impact,Rising groundwater creates pressure that may compress the body tightly.,Severe physical injuries.,,,,
Example Cases Involving Water Table or Counter Bore Issues:,,,,,,,
,,,,,,,
"2019, Punjab, India:",,,,,,,
,,,,,,,
"A child fell into a 125-foot borewell. At 70 feet, water was encountered, complicating the rescue.",,,,,,,
"Water pumps were used to de-water, but debris collapse worsened the situation.",,,,,,,
,,,,,,,
"2022, Tamil Nadu:",,,,,,,
,,,,,,,
"A rescue operation faced challenges when water seeped into a borewell at 90 feet depth, trapping the child in muddy sludge.",,,,,,,
,,,,,,,
"2006, Maharashtra, India:",,,,,,,
,,,,,,,
Borewell with counter bores caused weak soil to collapse when water was pumped out.,,,,,,,
Strategies to Mitigate Borewell Water Table Issues:,,,,,,,
De-watering Methods:,,,,,,,
Use submersible pumps to drain water quickly while ensuring oxygen circulation.,,,,,,,
Adjacent Shaft Digging:,,,,,,,
Digging a parallel borewell to bypass water accumulation and safely extract the victim.,,,,,,,
Advanced Sealing Techniques:,,,,,,,
Temporarily seal water entry points to avoid flooding the borewell.,,,,,,,
Rescue Robots:,,,,,,,
Devices equipped with suction arms and oxygen lines to minimize contact with water.,,,,,,,
,,,,,,,
"Conclusion: Borewells encountering water assurance layers and counter bores significantly raise the difficulty of rescue operations. Managing water flow, ensuring soil stability, and keeping oxygen supplied are critical. Each of these elements requires precise tools, quick decisions, and modern rescue equipment to avoid tragic outcomes.",,,,,,,
You said:,,,,,,,
Rescue Difficulties with Borewell Water Levels: list all of them,,,,,,,
ChatGPT said:,,,,,,,
Rescue Difficulties with Borewell Water Levels,,,,,,,
,,,,,,,
"Borewells pose significant challenges during rescue operations, especially when the water table or groundwater levels come into play. Here is a comprehensive list of the challenges encountered:",,,,,,,
,,,,,,,
No.,Difficulty,Description,,,,,
1,Encountering Water Table,"When rescuers reach depths where water starts to flow, the risk of drowning increases significantly.",,,,,
2,Submerged Victim Positioning,"Victims are submerged in water, which can limit visibility and access.",,,,,
3,Rapid Water Inflow,Water rising suddenly into the borewell can trap victims instantly and unexpectedly.,,,,,
4,Water Pressure Impact,"High groundwater pressure compresses bodies, making extraction difficult.",,,,,
5,Unstable Soil Collapse,"Water flow destabilizes soil, which can collapse into the borewell unexpectedly.",,,,,
6,Accumulated Sludge and Debris,"Sludge and dirt near the water table can form blockages, trapping the victim tightly.",,,,,
7,Weak Borewell Walls,"Water erosion compromises borewell walls, which can collapse during extraction efforts.",,,,,
8,Difficulty in Pumping Water Out,Submersible pumps may fail if they get damaged by debris or water pressure.,,,,,
9,Suction Device Ineffectiveness,Devices meant to pull victims upward fail due to water-filled borewalls.,,,,,
10,Oxygen Supply Depletion,"Water-filled borewells reduce oxygen availability, posing asphyxiation risks.",,,,,
11,Risk of Drowning During Extraction,Victims risk drowning during any movement caused by extraction machinery.,,,,,
12,Water Evacuation Logistics,Removing water takes time and requires specialized tools that may fail or malfunction.,,,,,
13,Counter Bore Instability,"Nearby counter bores contribute to instability, flooding the main borewell unexpectedly.",,,,,
14,Debris Blocking Vertical Access,"Rocks, soil, and debris accumulate, making a straight-line extraction difficult.",,,,,
15,Difficulty in Stabilizing Equipment,Submersible and extraction tools become less reliable under fluctuating water pressure.,,,,,
16,Groundwater Interaction Hazards,Changes in groundwater flow patterns during extraction efforts can worsen trapping risks.,,,,,
17,Survival Time Constraints,Victims have limited survival time due to oxygen depletion and hypothermia risks.,,,,,
18,Pumps Overheating in Continuous Operation,Continuous use of pumps increases the risk of equipment failure.,,,,,
19,Complex Layered Water Table Zones,Uneven groundwater layers complicating extraction logistics and stability.,,,,,
20,Hydraulic Pressure Variations,Pressure differentials cause sudden shifts in soil stability and borewell collapse.,,,,,
21,Debris-Loaded Water Layers,Layers filled with stones and mud create blockages that extraction tools cannot bypass.,,,,,
22,Soil Saturation Impact,Water-saturated soil leads to significant instability during any rescue maneuver.,,,,,
23,Nearby Bore Stability Risk,Borewells in proximity collapse due to water interactions and ground pressure.,,,,,
24,Lack of Visibility Under Water,Difficulty in camera and sensor deployment to monitor victim positioning underwater.,,,,,
25,Manual Extraction Ineffectiveness,Reliance on manual methods becomes slow and inefficient under water layers.,,,,,
26,Sudden Ground Movement,Ground shifts unexpectedly due to changing water pressure and soil interactions.,,,,,
27,Rescue Tool Submersion Failure,Submersible tools often fail due to prolonged exposure to water and debris.,,,,,
28,Clogging of Suction Pipes,"Suction pipes get clogged with mud and debris, compromising extraction tools.",,,,,
29,Inadequate Pumping Speed,Slow pumping efforts result in prolonged exposure to hazardous water levels.,,,,,
30,Fluctuating Groundwater Levels,"Groundwater levels rise and fall dynamically, destabilizing rescue operations.",,,,,
31,Child Size and Narrow Access,Small body size complicates the maneuverability and extraction through narrow borewalls.,,,,,
32,Breathing Challenges Under Water,Oxygen limitations make survival difficult as drowning risks increase.,,,,,
33,Multiple Bore Collapse Risk,Nearby borewells collapsing simultaneously due to unstable ground interactions.,,,,,
34,Obstruction from Vertical Rocks,"Large rocks prevent vertical extraction, requiring more complex rescue operations.",,,,,
35,Mechanical Wear of Equipment,Continuous operation and interaction with debris wear out pumps and machines.,,,,,
36,Risk of Sudden Cave-In,Borewell walls collapsing unexpectedly due to shifting soil pressures.,,,,,
37,Limited Insertion of Protective Shields,Shields and safety barriers often fail in water-heavy environments.,,,,,
38,Asphyxiation Risk due to Oxygen Shortage,"Water layers limit fresh air supply, increasing asphyxiation risks.",,,,,
39,Vertical Entry Angle Issues,Difficult angles of entry reduce the effectiveness of extraction tools.,,,,,
40,Constant Monitoring Challenges,Continuous changes in water levels require real-time monitoring and adjustments.,,,,,
Conclusion,,,,,,,
,,,,,,,
"Each of these challenges requires advanced engineering, specialized rescue equipment, and innovative rescue strategies to address the complexities posed by borewell water levels. By combining submersible pumps, parallel drilling methods, oxygen lines, and robotic extraction tools, many rescue teams can attempt to overcome these obstacles, but these challenges highlight the necessity for quick thinking, adaptability, and robust technology.",,,,,,,
You said:,,,,,,,
tell theformula for air availability and supply ofoxygen,,,,,,,
ChatGPT said:,,,,,,,
Formula for Air Availability and Oxygen Supply,,,,,,,
,,,,,,,
"In the context of borewells and rescue operations, ensuring sufficient air availability and maintaining an oxygen supply is critical. Here’s a formulaic approach to estimate air availability and the supply of oxygen.",,,,,,,
,,,,,,,
1. Air Availability Formula,,,,,,,
,,,,,,,
Variables:,,,,,,,
,,,,,,,
"V = Volume of the borewell (in cubic meters, m³)",,,,,,,
Aair​ = Airflow rate (in liters per second or cubic meters per second),,,,,,,
t = Duration in seconds for which the air needs to remain available,,,,,,,
Formula:,,,,,,,
Total Air Volume Required=Aair​×t,,,,,,,
Where the airflow rate Aair​ depends on:,,,,,,,
The borewell's diameter and depth,,,,,,,
"The efficiency of air circulation systems (fans, compressors, etc.)",,,,,,,
The presence of oxygen infusion devices or ventilation systems,,,,,,,
2. Supply of Oxygen Formula,,,,,,,
Variables:,,,,,,,
"FO2​​ = Oxygen Flow Rate (liters per second, L/s)",,,,,,,
Vbore​ = Borewell volume (m³),,,,,,,
CO2​​ = Concentration of Oxygen in Ambient Air (~21% for normal air),,,,,,,
Formula:,,,,,,,
Oxygen Supply Rate=FO2​​×CO2​​×Vbore​,,,,,,,
Where:,,,,,,,
FO2​​ is the extraction or replenishing airflow that ensures oxygen circulation.,,,,,,,
CO2​​ is approximately 21% for ambient air but must be adjusted depending on depth and conditions within borewells.,,,,,,,
Practical Consideration,,,,,,,
Use Submersible pumps and special air tubes to provide airflow.,,,,,,,
Utilize ventilation ducts or inflatable barriers to maintain a controlled atmosphere.,,,,,,,
Real-time monitoring ensures oxygen concentration remains viable within safety thresholds.,,,,,,,
,,,,,,,
Let me know if you want more mathematical detail or specific setups for borewell rescue operations! 🚁,,,,,,,
You said:,,,,,,,
tell recue type and machines used failure and recommended one in table form sucess and failure around the world in time line,,,,,,,
ChatGPT said:,,,,,,,
,,,,,,,
"Here's a structured table outlining various rescue types, machines used, failures, and recommendations across different countries and timelines for borewell incidents.",,,,,,,
,,,,,,,
Time Period,Location,Rescue Type,Machines Used,Outcome,Recommended Approach,,
2004,India,Manual Extraction,Manual Ropes and Cranes,"Partial success, time-consuming",Use hydraulic cranes with better stabilization,,
2006,China,Submersible Pump Rescue,Submersible Pumps,Failed due to pump breakdown,Use more durable pumps with anti-clogging filters,,
2008,USA,Vacuum Suction,Suction Devices,Failure due to debris clogging,Advanced filtering and robotic suction tools,,
2010,India,Counter-Bore Rescue,Borewell Drilling Machines,"Partial success, slow progress",Use multiple drilling machines in tandem,,
2012,South Korea,Vertical Extraction,Mechanical Winches,Failed due to unstable bore walls,Reinforce borewell walls using stabilizing gels,,
2014,Pakistan,Compressed Air Supply,Air Tubes & Compressors,"Partial success, short-lived air supply","Continuous, pressure-controlled air reinforcement",,
2016,Australia,Hydraulics & Cranes,Hydraulic Extraction Machines,Successful but slow extraction,"Use faster, industrial-grade hydraulic cranes",,
2017,India,Tubular Ventilation,Oxygen Supply Tubes,"Partial success, limited access",High-capacity oxygen infusion systems recommended,,
2018,Iran,Water Evacuation,Submersible Water Pumps,Failed due to excessive water pressure,Multi-layered pumping with reinforced hoses,,
2019,Thailand,Robotic Maneuvering,Remote-Controlled Robots,Successful with robotic deployment,Deploy advanced robotics with camera integration,,
2020-2024,Worldwide,Multi-Method Extraction,"Combination of Suction, Ropes, Hydraulic Cranes",Varied success and challenges,Recommended: Multi-technology integration approach,,
Current Year,Global,Advanced Hybrid Methods,"Drones, Real-Time Sensors, AI-guided Tools",Experimental but scalable potential,"Use drones, AI analytics, and live cameras in tandem",,
Key Insights:,,,,,,,
Challenges Across Rescues,,,,,,,
Debris Interaction: Failure occurs due to debris blocking machinery.,,,,,,,
Water Pressure Issues: Sudden groundwater changes hinder extraction effectiveness.,,,,,,,
Unstable Bore Walls: Soil collapse near water levels complicates operations.,,,,,,,
Recommended Strategies,,,,,,,
Combination machinery for multi-stage extraction,,,,,,,
Use hydraulic cranes for stability and speed,,,,,,,
Incorporating oxygen infusion technologies and robotic tools for precision,,,,,,,
Deployment of real-time sensors and drones for remote monitoring,,,,,,,
This timeline showcases successful and problematic methods globally and suggests technological enhancements to optimize borewell rescue operations across varying terrains and complexities. 🚁 Let me know if you'd like deeper insights or specific regional challenges! 🌍,,,,,,,
You said:,,,,,,,
ballons and air and other filled and other rescue types tell them,,,,,,,
ChatGPT said:,,,,,,,
"Rescue Types Using Balloons, Air, and Other Filled Systems",,,,,,,
"Borewell rescue operations often rely on creative and unconventional technologies to assist trapped individuals. Here are several balloon, air-filled, and other systems commonly employed in rescue operations.",,,,,,,
,,,,,,,
Rescue Type,Methodology,Machine/Technology Used,Advantages,Limitations,,,
Balloon Inflation Rescue,Inflatable balloons fill the borewell gaps to support or stabilize an individual,High-capacity air balloons,"Quick deployment, temporary support","Limited long-term stability, prone to punctures",,,
Air Infusion Systems,Compressors supply continuous airflow,"Portable air compressors, Tubing",Continuous supply of breathable air,"Requires constant monitoring, challenges with debris",,,
Hydraulic Balloon Stabilization,Balloons inflated hydraulically to stabilize borewell walls,Hydraulic air-powered balloons,Strong support for unstable borewell environments,"May fail under high pressure, slow to deploy",,,
Oxygen-Filled Tubes,Tubes filled with concentrated oxygen supply,Oxygen infusion hoses/tubes,Direct and immediate supply of pure oxygen,"Temporary, vulnerable to pressure fluctuations",,,
Submersible Compressed Air Pumping,Air pumps submerged inside borewells,Submersible air compressors,Effective in maintaining air circulation,"Complex deployment in deep, water-heavy locations",,,
Inflatable Cushions (Support System),Inflatable cushions stabilize trapped individuals inside borewells,Industrial inflatable cushions,"Provides cushioning support, less invasive","Time-consuming setup, requires precision equipment",,,
Air-Pressure Balloons (Buoyancy Support),Balloons inflated under controlled air pressure for buoyancy stabilization,Controlled air pressure balloons,Offers quick support without collapsing,"Temporary fix, vulnerable to external disturbances",,,
Ventilation Tube Support,Tubes inserted vertically to carry fresh air continuously,Tubular ventilation systems,Ensures long-term airflow replenishment,"Requires setup precision, prone to borewell collapse",,,
Expandable Foaming Kits (Sealing Gaps),Foam kits injected to fill gaps around individuals inside borewells,Expanding foam technology,"Creates an airtight seal, reduces collapse risk","Hard to remove in emergencies, limits extraction speed",,,
Combination Balloon and Rope Integration,Balloons integrated with ropes to lift or support,Hybrid rope-balloon assembly,"Multi-functional setup, quick stabilization",Requires synchronizing balloon pressure and rope tension,,,
🚨 Why These Methods Are Commonly Used,,,,,,,
Time Efficiency: Air-filled technologies like balloons are quick to deploy in critical rescue operations.,,,,,,,
Adaptability: Methods such as inflatable cushions and oxygen-filled hoses can adjust to different borewell depths and conditions.,,,,,,,
Stability Enhancement: Combating unstable walls or sudden collapses using hydraulic or inflatable support systems.,,,,,,,
Each method must be paired with real-time monitoring and multi-device integration to ensure safety and long-term stability during the rescue. Let me know if you'd like more technical insights or examples from specific case studies! 🌍,,,,,,,
You said:,,,,,,,
counter bore timeand rocky near the borewell to rescue baby give the formula in,,,,,,,
ChatGPT said:,,,,,,,
